<?xml version="1.0"?>
<!DOCTYPE Report
[
<!ELEMENT Report (General ,(Doc|BPT)) >
<!ATTLIST Report ver CDATA #REQUIRED tmZone CDATA #REQUIRED>

<!ELEMENT General ( DocLocation ) >
<!ATTLIST General productName CDATA #REQUIRED productVer CDATA #REQUIRED os CDATA #REQUIRED host CDATA #REQUIRED qcserver CDATA #IMPLIED qcproject CDATA #IMPLIED SolManSolutionId CDATA #IMPLIED SolManProjectId CDATA #IMPLIED SolManTestPlanId CDATA #IMPLIED SolManTestPackageId CDATA #IMPLIED SolManUserInfoData CDATA #IMPLIED  >

<!ELEMENT BPT (DName,Res,DVer?,TSet?,TInst?,NodeArgs,AdditionalInfo*,Doc*) >
<!ATTLIST BPT rID ID #REQUIRED >

<!ELEMENT Doc (DName,ConfName?,Res,DVer?,TSet?,TInst?,RunType?,DT?,AdditionalInfo*,Step*,DIter*,Step*,Action*,Doc*,Summary?,TestMaintenanceSummary*,NodeArgs?) >
<!ATTLIST Doc rID ID #REQUIRED type (Test|BC|BPTWrapperTest|Flow|Group|Action) "Test" productName CDATA #REQUIRED BCIter CDATA #IMPLIED >

<!ELEMENT RunType ( #PCDATA )>
<!ATTLIST RunType fmStep (False|True) "False" batch (False|True) "False" upDesc (False|True) "False" upChk (False|True) "False" upAS (False|True) "False">

<!ELEMENT DName ( #PCDATA ) >

<!ELEMENT ConfName ( #PCDATA ) >

<!ELEMENT Res ( #PCDATA ) >

<!ELEMENT AdditionalInfo (AdditionalDataName,AdditionalDataValue ) >

<!ELEMENT AdditionalDataName ( #PCDATA ) >

<!ELEMENT AdditionalDataValue ( #PCDATA ) >

<!ELEMENT DVer ( #PCDATA ) >

<!ELEMENT TSet ( #PCDATA ) >

<!ELEMENT TInst ( #PCDATA ) >

<!ELEMENT DIter (Step*,Action+,Summary?,NodeArgs)>
<!ATTLIST DIter rID ID #REQUIRED iterID CDATA #REQUIRED>

<!ELEMENT DocLocation ( #PCDATA )>

<!ELEMENT Action (AName,AIter*,(Step|HtmlStep|Action)*, Summary,ActionMaintenanceSummary*, NodeArgs ) >
<!ATTLIST Action rID ID #REQUIRED>

<!ELEMENT AIter ((Step|HtmlStep|Action)*,DataMapping?, Summary?,NodeArgs) >
<!ATTLIST AIter rID ID #REQUIRED iterID CDATA #REQUIRED isCountable (False|True) "False" >

<!ELEMENT AName ( #PCDATA ) >

<!ELEMENT TestMaintenanceSummary (ActionMaintenanceSummary*) >
<!ATTLIST TestMaintenanceSummary ObjectsAdded CDATA #REQUIRED ObjectsUpdated CDATA #REQUIRED StepsUpdated CDATA #REQUIRED StepsComments CDATA #REQUIRED><!ELEMENT ActionMaintenanceSummary (ObjectChange* ) >
<!ATTLIST ActionMaintenanceSummary Action CDATA #REQUIRED Objects CDATA #REQUIRED Updated CDATA #REQUIRED LinesTotal CDATA #REQUIRED Added CDATA #REQUIRED LinesUpdated CDATA #REQUIRED>

<!ELEMENT ObjectChange  (Hierarchy, PropertyChangeList* ) >
<!ATTLIST ObjectChange Operation CDATA #IMPLIED OriginalRepository CDATA #IMPLIED>

<!ELEMENT PropertyChangeList (PropertyDef*) >

<!ELEMENT PropertyDef (OriginalValue, NewValue) >
<!ATTLIST PropertyDef PropName CDATA #REQUIRED OriginRegularExpression (True|False) "False" NewRegularExpression (True|False) "False" AddedProperty (True|False) "False" >

<!ELEMENT OriginalValue ( #PCDATA )>

<!ELEMENT NewValue ( #PCDATA )>

<!ELEMENT Hierarchy  (ObjectName, Hierarchy*) >
<!ATTLIST Hierarchy MicClass CDATA #REQUIRED>

<!ELEMENT ObjectName  ( #PCDATA ) >

<!ELEMENT Step (Obj,Details,Time,TimeTick* ,(Step|HtmlStep|Doc)*, DataMapping?, NodeArgs) >
<!ATTLIST Step rID ID #REQUIRED retval CDATA #IMPLIED>

<!ELEMENT HtmlStep (HTML,TimeTick*,(Step|HtmlStep|Doc)*,NodeArgs) >
<!ATTLIST HtmlStep rID ID #REQUIRED >

<!ELEMENT Obj ( #PCDATA ) >
<!ATTLIST Obj plainTxt (False|True) "True">

<!ELEMENT Details ( #PCDATA ) >
<!ATTLIST Details plainTxt (False|True) "True">

<!ELEMENT Time ( #PCDATA ) >

<!ELEMENT HTML ( #PCDATA ) >

<!ELEMENT Disp ( #PCDATA ) >

<!ELEMENT TimeTick ( #PCDATA ) >

<!ELEMENT DataMapping ( DataMappedItem* )>
<!ELEMENT DataMappedItem EMPTY >
<!ATTLIST DataMappedItem dsName CDATA #REQUIRED >
<!ATTLIST DataMappedItem rowId CDATA #REQUIRED >

<!ELEMENT NodeArgs (Disp,TopPane?,BtmPane?,ExtendedInfo? )>
<!ATTLIST NodeArgs eType CDATA #REQUIRED icon CDATA #REQUIRED nRep CDATA #REQUIRED UserNote CDATA #IMPLIED filter (False|True) "True">
<!ATTLIST NodeArgs status (Passed|Failed|Done|Warning|Information) "Done">
<!ATTLIST NodeArgs iconSel CDATA #IMPLIED nType CDATA #IMPLIED MovieMarker CDATA "">
<!ATTLIST NodeArgs Source CDATA #IMPLIED SourceLine CDATA #IMPLIED StepFlowItemKey CDATA #IMPLIED >

<!ELEMENT TopPane (Path)>

<!ELEMENT BtmPane ( (Path|WR)?,ASHilite?)>
<!ATTLIST BtmPane vType CDATA "HTML">

<!ELEMENT Path ( #PCDATA ) >

<!ELEMENT ASHilite ( #PCDATA ) >

<!ELEMENT WR ( #PCDATA ) >

<!ELEMENT ExtendedInfo ( StepData ) >

<!ATTLIST ExtendedInfo StepType CDATA #REQUIRED>
<!ELEMENT DT (NodeArgs) >
<!ATTLIST DT rID ID #REQUIRED>

<!ELEMENT Summary (Param*)>
<!ATTLIST Summary sTime CDATA #IMPLIED eTime CDATA #IMPLIED passed CDATA #IMPLIED failed CDATA #IMPLIED warnings CDATA #IMPLIED retval CDATA #IMPLIED stopped (False|True) "False" >

<!ELEMENT Param (ParamName,ParamVal)+ >
<!ATTLIST Param paramInOut (In|Out) "In">

<!ELEMENT ParamName ( #PCDATA ) >

<!ELEMENT ParamVal ( #PCDATA ) >

]
>
<Report ver="2.0" tmZone="India Standard Time">
<General productName="HPE Unified Functional Testing" productVer="14.03" os="" host="LIN33001220"><DocLocation><![CDATA[C:\framework\QTP-Hybrid-Framework\QTP-Hybrid-Framework\TestCases\orangedp]]></DocLocation></General>
<Doc rID="T1"   productName= "HPE Unified Functional Testing"  >
<DName><![CDATA[orangedp]]></DName>
<Res><![CDATA[Res9]]></Res>
<DT rID="T2">
<NodeArgs eType="Table" icon="2" nRep="4" filter="False" >
<Disp><![CDATA[Run-Time Data Table]]></Disp>
<BtmPane vType="Table" >
<Path><![CDATA[Default.xls]]></Path>
</BtmPane>
</NodeArgs>
</DT>
<DIter rID="T3" iterID="1" >
<Step rID="T4">
<Obj plainTxt="False" ><![CDATA[StartUp Browser]]></Obj>
<Details plainTxt="False" ><![CDATA[<table><tr><td><span style="text-align : left; font-size : 12px; ">Local Browser</span></td></tr></table>]]></Details>
<Time><![CDATA[14-02-2023 - 21:10:21]]></Time>
<TimeTick>1676389221</TimeTick>
<Step rID="T5">
<Obj plainTxt="False" ><![CDATA[StartUp Browser.Navigate]]></Obj>
<Details plainTxt="False" ><![CDATA[Navigate to https://opensource-demo.orangehrmlive.com/web/index.php/auth/login]]></Details>
<Time><![CDATA[14-02-2023 - 21:10:21]]></Time>
<TimeTick>1676389221</TimeTick>
<NodeArgs eType="Replay" icon="4" nRep="9" Source="Action0" SourceLine="-1" >
<Disp><![CDATA[StartUp Browser.Navigate]]></Disp>
</NodeArgs>
</Step>
<Step rID="T6">
<Obj plainTxt="False" ><![CDATA[StartUp Browser.Sync]]></Obj>
<Details plainTxt="False" ><![CDATA[]]></Details>
<Time><![CDATA[14-02-2023 - 21:10:23]]></Time>
<TimeTick>1676389223</TimeTick>
<NodeArgs eType="Replay" icon="4" nRep="11" Source="Action0" SourceLine="-1" >
<Disp><![CDATA[StartUp Browser.Sync]]></Disp>
</NodeArgs>
</Step>
<NodeArgs eType="Context" icon="4" nRep="8" Source="Action0" SourceLine="-1" >
<Disp><![CDATA[StartUp Browser]]></Disp>
</NodeArgs>
</Step>
<Action rID="T7">
<AName><![CDATA[login]]></AName>
<Step rID="T8">
<Obj plainTxt="False" ><![CDATA[[ username ].Set]]></Obj>
<Details plainTxt="False" ><![CDATA["Admin"]]></Details>
<Time><![CDATA[14-02-2023 - 21:10:24]]></Time>
<TimeTick>1676389224</TimeTick>
<NodeArgs eType="Replay" icon="6" nRep="16" Source="login" SourceLine="1" >
<Disp><![CDATA[[ username ].Set]]></Disp>
</NodeArgs>
</Step>
<Step rID="T9">
<Obj plainTxt="False" ><![CDATA[OrangeHRM]]></Obj>
<Details plainTxt="False" ><![CDATA[<table><tr><td><span style="text-align : left; font-size : 12px; ">Local Browser</span></td></tr></table>]]></Details>
<Time><![CDATA[14-02-2023 - 21:10:24]]></Time>
<TimeTick>1676389224</TimeTick>
<Step rID="T10">
<Obj plainTxt="False" ><![CDATA[OrangeHRM]]></Obj>
<Details plainTxt="False" ><![CDATA[Page]]></Details>
<Time><![CDATA[14-02-2023 - 21:10:24]]></Time>
<TimeTick>1676389224</TimeTick>
<Step rID="T11">
<Obj plainTxt="False" ><![CDATA[password.Set]]></Obj>
<Details plainTxt="False" ><![CDATA["63eba69e3e6cb9bc8938fdba0a51acf09a101461331c"]]></Details>
<Time><![CDATA[14-02-2023 - 21:10:24]]></Time>
<TimeTick>1676389224</TimeTick>
<NodeArgs eType="Replay" icon="6" nRep="21" Source="login" SourceLine="2" >
<Disp><![CDATA[password.Set]]></Disp>
</NodeArgs>
</Step>
<Step rID="T12">
<Obj plainTxt="False" ><![CDATA[Login.Click]]></Obj>
<Details plainTxt="False" ><![CDATA[]]></Details>
<Time><![CDATA[14-02-2023 - 21:10:24]]></Time>
<TimeTick>1676389224</TimeTick>
<NodeArgs eType="Replay" icon="8" nRep="24" Source="login" SourceLine="3" >
<Disp><![CDATA[Login.Click]]></Disp>
</NodeArgs>
</Step>
<NodeArgs eType="Context" icon="7" nRep="20" Source="login" SourceLine="2" >
<Disp><![CDATA[OrangeHRM]]></Disp>
</NodeArgs>
</Step>
<Step rID="T13">
<Obj plainTxt="False" ><![CDATA[OrangeHRM_2]]></Obj>
<Details plainTxt="False" ><![CDATA[Page]]></Details>
<Time><![CDATA[14-02-2023 - 21:10:27]]></Time>
<TimeTick>1676389227</TimeTick>
<Step rID="T14">
<Obj plainTxt="False" ><![CDATA[PIM.Click]]></Obj>
<Details plainTxt="False" ><![CDATA[]]></Details>
<Time><![CDATA[14-02-2023 - 21:10:27]]></Time>
<TimeTick>1676389227</TimeTick>
<NodeArgs eType="Replay" icon="9" nRep="30" Source="login" SourceLine="4" >
<Disp><![CDATA[PIM.Click]]></Disp>
</NodeArgs>
</Step>
<NodeArgs eType="Context" icon="7" nRep="29" Source="login" SourceLine="4" >
<Disp><![CDATA[OrangeHRM_2]]></Disp>
</NodeArgs>
</Step>
<Step rID="T15">
<Obj plainTxt="False" ><![CDATA[OrangeHRM_3]]></Obj>
<Details plainTxt="False" ><![CDATA[Page]]></Details>
<Time><![CDATA[14-02-2023 - 21:10:30]]></Time>
<TimeTick>1676389230</TimeTick>
<Step rID="T16">
<Obj plainTxt="False" ><![CDATA[WebEdit.Set]]></Obj>
<Details plainTxt="False" ><![CDATA["1112"]]></Details>
<Time><![CDATA[14-02-2023 - 21:10:30]]></Time>
<TimeTick>1676389230</TimeTick>
<NodeArgs eType="Replay" icon="6" nRep="39" Source="login" SourceLine="5" >
<Disp><![CDATA[WebEdit.Set]]></Disp>
</NodeArgs>
</Step>
<Step rID="T17">
<Obj plainTxt="False" ><![CDATA[Search.Click]]></Obj>
<Details plainTxt="False" ><![CDATA[]]></Details>
<Time><![CDATA[14-02-2023 - 21:10:30]]></Time>
<TimeTick>1676389230</TimeTick>
<NodeArgs eType="Replay" icon="8" nRep="42" Source="login" SourceLine="6" >
<Disp><![CDATA[Search.Click]]></Disp>
</NodeArgs>
</Step>
<Step rID="T18">
<Obj plainTxt="False" ><![CDATA[Search.Click]]></Obj>
<Details plainTxt="False" ><![CDATA[]]></Details>
<Time><![CDATA[14-02-2023 - 21:10:30]]></Time>
<TimeTick>1676389230</TimeTick>
<NodeArgs eType="Replay" icon="8" nRep="45" Source="login" SourceLine="7" >
<Disp><![CDATA[Search.Click]]></Disp>
</NodeArgs>
</Step>
<Step rID="T19">
<Obj plainTxt="False" ><![CDATA[Add.Click]]></Obj>
<Details plainTxt="False" ><![CDATA[]]></Details>
<Time><![CDATA[14-02-2023 - 21:10:30]]></Time>
<TimeTick>1676389230</TimeTick>
<NodeArgs eType="Replay" icon="8" nRep="48" Source="login" SourceLine="8" >
<Disp><![CDATA[Add.Click]]></Disp>
</NodeArgs>
</Step>
<NodeArgs eType="Context" icon="7" nRep="38" Source="login" SourceLine="5" >
<Disp><![CDATA[OrangeHRM_3]]></Disp>
</NodeArgs>
</Step>
<Step rID="T20">
<Obj plainTxt="False" ><![CDATA[OrangeHRM_5]]></Obj>
<Details plainTxt="False" ><![CDATA[Page]]></Details>
<Time><![CDATA[14-02-2023 - 21:10:34]]></Time>
<TimeTick>1676389234</TimeTick>
<Step rID="T21">
<Obj plainTxt="False" ><![CDATA[firstName.Set]]></Obj>
<Details plainTxt="False" ><![CDATA["suvi"]]></Details>
<Time><![CDATA[14-02-2023 - 21:10:34]]></Time>
<TimeTick>1676389234</TimeTick>
<NodeArgs eType="Replay" icon="6" nRep="53" Source="login" SourceLine="9" >
<Disp><![CDATA[firstName.Set]]></Disp>
</NodeArgs>
</Step>
<Step rID="T22">
<Obj plainTxt="False" ><![CDATA[lastName.Set]]></Obj>
<Details plainTxt="False" ><![CDATA["devi"]]></Details>
<Time><![CDATA[14-02-2023 - 21:10:34]]></Time>
<TimeTick>1676389234</TimeTick>
<NodeArgs eType="Replay" icon="6" nRep="56" Source="login" SourceLine="10" >
<Disp><![CDATA[lastName.Set]]></Disp>
</NodeArgs>
</Step>
<Step rID="T23">
<Obj plainTxt="False" ><![CDATA[WebEdit.Set]]></Obj>
<Details plainTxt="False" ><![CDATA["03332"]]></Details>
<Time><![CDATA[14-02-2023 - 21:10:34]]></Time>
<TimeTick>1676389234</TimeTick>
<NodeArgs eType="Replay" icon="6" nRep="59" Source="login" SourceLine="11" >
<Disp><![CDATA[WebEdit.Set]]></Disp>
</NodeArgs>
</Step>
<Step rID="T24">
<Obj plainTxt="False" ><![CDATA[Save.Click]]></Obj>
<Details plainTxt="False" ><![CDATA[]]></Details>
<Time><![CDATA[14-02-2023 - 21:10:34]]></Time>
<TimeTick>1676389234</TimeTick>
<NodeArgs eType="Replay" icon="8" nRep="62" Source="login" SourceLine="12" >
<Disp><![CDATA[Save.Click]]></Disp>
</NodeArgs>
</Step>
<NodeArgs eType="Context" icon="7" nRep="52" Source="login" SourceLine="9" >
<Disp><![CDATA[OrangeHRM_5]]></Disp>
</NodeArgs>
</Step>
<Step rID="T25">
<Obj plainTxt="False" ><![CDATA[OrangeHRM_7]]></Obj>
<Details plainTxt="False" ><![CDATA[Page]]></Details>
<Time><![CDATA[14-02-2023 - 21:10:34]]></Time>
<TimeTick>1676389234</TimeTick>
<Step rID="T26">
<Obj plainTxt="False" ><![CDATA[Save.Click]]></Obj>
<Details plainTxt="False" ><![CDATA[]]></Details>
<Time><![CDATA[14-02-2023 - 21:10:34]]></Time>
<TimeTick>1676389234</TimeTick>
<NodeArgs eType="Replay" icon="8" nRep="66" Source="login" SourceLine="13" >
<Disp><![CDATA[Save.Click]]></Disp>
</NodeArgs>
</Step>
<Step rID="T27">
<Obj plainTxt="False" ><![CDATA[Save_2.Click]]></Obj>
<Details plainTxt="False" ><![CDATA[]]></Details>
<Time><![CDATA[14-02-2023 - 21:10:34]]></Time>
<TimeTick>1676389234</TimeTick>
<NodeArgs eType="Replay" icon="8" nRep="69" Source="login" SourceLine="14" >
<Disp><![CDATA[Save_2.Click]]></Disp>
</NodeArgs>
</Step>
<Step rID="T28">
<Obj plainTxt="False" ><![CDATA[PIM.Click]]></Obj>
<Details plainTxt="False" ><![CDATA[]]></Details>
<Time><![CDATA[14-02-2023 - 21:10:34]]></Time>
<TimeTick>1676389234</TimeTick>
<NodeArgs eType="Replay" icon="9" nRep="72" Source="login" SourceLine="15" >
<Disp><![CDATA[PIM.Click]]></Disp>
</NodeArgs>
</Step>
<NodeArgs eType="Context" icon="7" nRep="65" Source="login" SourceLine="13" >
<Disp><![CDATA[OrangeHRM_7]]></Disp>
</NodeArgs>
</Step>
<Step rID="T29">
<Obj plainTxt="False" ><![CDATA[OrangeHRM_3]]></Obj>
<Details plainTxt="False" ><![CDATA[Page]]></Details>
<Time><![CDATA[14-02-2023 - 21:10:36]]></Time>
<TimeTick>1676389236</TimeTick>
<Step rID="T30">
<Obj plainTxt="False" ><![CDATA[WebEdit.Set]]></Obj>
<Details plainTxt="False" ><![CDATA["03332"]]></Details>
<Time><![CDATA[14-02-2023 - 21:10:36]]></Time>
<TimeTick>1676389236</TimeTick>
<NodeArgs eType="Replay" icon="6" nRep="77" Source="login" SourceLine="16" >
<Disp><![CDATA[WebEdit.Set]]></Disp>
</NodeArgs>
</Step>
<Step rID="T31">
<Obj plainTxt="False" ><![CDATA[Search.Click]]></Obj>
<Details plainTxt="False" ><![CDATA[]]></Details>
<Time><![CDATA[14-02-2023 - 21:10:36]]></Time>
<TimeTick>1676389236</TimeTick>
<NodeArgs eType="Replay" icon="8" nRep="80" Source="login" SourceLine="17" >
<Disp><![CDATA[Search.Click]]></Disp>
</NodeArgs>
</Step>
<Step rID="T32">
<Obj plainTxt="False" ><![CDATA[WebCheckBox]]></Obj>
<Details plainTxt="False" ><![CDATA[Cannot&nbsp;identify&nbsp;the&nbsp;object&nbsp;"WebCheckBox"&nbsp;(of&nbsp;class&nbsp;WebCheckBox).<br/>Verify&nbsp;that&nbsp;this&nbsp;object's&nbsp;properties&nbsp;match&nbsp;an&nbsp;object&nbsp;currently&nbsp;displayed&nbsp;in&nbsp;your&nbsp;application.]]></Details>
<Time><![CDATA[14-02-2023 - 21:10:57]]></Time>
<TimeTick>1676389257</TimeTick>
<Step rID="T33">
<Obj plainTxt="False" ><![CDATA[WebCheckBox]]></Obj>
<Details plainTxt="False" ><![CDATA[Object's physical description:<br>role = <br>Mercury Class = WebCheckBox<br>Index = 1<br>Html Tag = INPUT<br>acc_name = <br>_xpath = //DIV[@role="cell"][1]/DIV[1]/DIV[1]/LABEL[1]/INPUT[1]<br>|Visible = -1<br>Value = 0<br>Type = checkbox<br>Name = <br>Html Id = <br>DHTML Class = <br>]]></Details>
<Time><![CDATA[14-02-2023 - 21:10:57]]></Time>
<TimeTick>1676389257</TimeTick>
<NodeArgs eType="Replay" icon="11" nRep="125" status="Warning" nType="Description" Source="login" SourceLine="18" >
<Disp><![CDATA[WebCheckBox]]></Disp>
</NodeArgs>
</Step>
<NodeArgs eType="Replay" icon="10" nRep="124" status="Failed" nType="Run Error" Source="login" SourceLine="18" >
<Disp><![CDATA[WebCheckBox]]></Disp>
</NodeArgs>
</Step>
<NodeArgs eType="Context" icon="7" nRep="76" status="Failed" Source="login" SourceLine="16" >
<Disp><![CDATA[OrangeHRM_3]]></Disp>
</NodeArgs>
</Step>
<NodeArgs eType="Context" icon="4" nRep="19" status="Failed" Source="login" SourceLine="2" >
<Disp><![CDATA[OrangeHRM]]></Disp>
</NodeArgs>
</Step>
<Step rID="T34">
<Obj plainTxt="False" ><![CDATA[OrangeHRM]]></Obj>
<Details plainTxt="False" ><![CDATA[<table><tr><td><span style="text-align : left; font-size : 12px; ">Local Browser</span></td></tr></table>]]></Details>
<Time><![CDATA[14-02-2023 - 21:10:57]]></Time>
<TimeTick>1676389257</TimeTick>
<Step rID="T35">
<Obj plainTxt="False" ><![CDATA[Run Error]]></Obj>
<Details plainTxt="False" ><![CDATA[Cannot identify the object &quot;WebCheckBox&quot; (of class WebCheckBox).<BR/>Verify that this object's properties match an object currently displayed in your application.<BR/>Line (19): &quot;Browser(&quot;OrangeHRM&quot;).Page(&quot;OrangeHRM_3&quot;).WebCheckBox(&quot;WebCheckBox&quot;).Set &quot;ON&quot;&quot;. ]]></Details>
<Time><![CDATA[14-02-2023 - 21:10:57]]></Time>
<TimeTick>1676389257</TimeTick>
<NodeArgs eType="Replay" icon="11" nRep="127" status="Failed" Source="login" SourceLine="18" >
<Disp><![CDATA[Run Error]]></Disp>
</NodeArgs>
</Step>
<Step rID="T36">
<Obj plainTxt="False" ><![CDATA[Stop Run]]></Obj>
<Details plainTxt="False" ><![CDATA[Run stopped by user.]]></Details>
<Time><![CDATA[14-02-2023 - 21:11:14]]></Time>
<TimeTick>1676389274</TimeTick>
<NodeArgs eType="General" icon="12" nRep="128" status="Information" >
<Disp><![CDATA[Stop Run]]></Disp>
</NodeArgs>
</Step>
<NodeArgs eType="Context" icon="4" nRep="126" status="Failed" Source="login" SourceLine="18" >
<Disp><![CDATA[OrangeHRM]]></Disp>
</NodeArgs>
</Step>
<Summary sTime="14-02-2023 - 21:10:23" eTime="14-02-2023 - 21:11:14" passed="0" failed="2" warnings="1" ></Summary>
<NodeArgs eType="StartAction" icon="5" nRep="12" status="Failed" >
<Disp><![CDATA[login Summary]]></Disp>
</NodeArgs>
</Action>
<NodeArgs eType="StartIteration" icon="3" nRep="6" status="Failed" >
<Disp><![CDATA[orangedp Iteration 1 (Row 1)]]></Disp>
</NodeArgs>
</DIter>
<Summary sTime="14-02-2023 - 21:10:21" eTime="14-02-2023 - 21:11:14" passed="0" failed="2" warnings="1" ></Summary>
<NodeArgs eType="StartTest" icon="1" nRep="3" status="Failed" >
<Disp><![CDATA[Test orangedp Summary]]></Disp>
</NodeArgs>
</Doc>
</Report>